,Name,Type ,Uses,Content,Side Effects,EAN,,,,
179,Acnedap Gel,allopathy,"Acne vulgaris, Pimples, Redness, Blackhead, Whitehead, Anti-bacterial, Anti-inflammatory","Dapsone, Sulfone antibiotic","Oily skin,Skin peeling,Dry skin,Erythema (skin redness)",,,,,
180,Accentrix Solution for Injection,allopathy,"Diabetic eye disease, Wet age-related macular degeneration, Macular edema due to retinal vein occlusion, Reducing abnormal blood vessel growth/leakage in the eye","Ranibizumab, 10mg/ml, Monoclonal antibody, Anti-angiogenic","Conjunctival hemorrhage,Eye pain,Eye inflammation,Increased intraocular pressure",,,,,
181,Arpizol 10 Tablet,allopathy,"Schizophrenia, Irritability linked with autism, Tourette's syndrome, Adjunctive treatment for major depressive disorder, Bipolar I Disorder (Manic Depression)","Aripiprazole, 10mg, Antipsychotic, Dopamine/Serotonin receptor stabilizer","Akathisia (inability to stay still),Anxiety,Blurred vision,Constipation,Dizziness,Fatigue,Headache,Increased saliva production,Indigestion,Insomnia (difficulty in sleeping),Nausea,Parkinsonism,Restlessness,Sleepiness,Tremor,Vomiting",,,,,
182,Alkasol Oral Solution,allopathy,"Gout, Kidney stones, Urinary tract infection, Metabolic disorders caused by kidney diseases","Disodium Hydrogen Citrate, 1.4g/dose, Urinary alkalizer","Stomach pain,Tiredness,Diarrhea,Nausea,Vomiting,Frequent urge to urinate",,,,,
183,Acular LS Ophthalmic Solution,allopathy,"Pain and inflammation after eye surgery, Seasonal allergies (ocular symptoms)","Ketorolac, 0.4% w/v, Non-steroidal anti-inflammatory drug, NSAID","Eye irritation,Eye pain,Superficial keratitis,Eye infection,Eye inflammation,Uveitis,Increased intraocular pressure,Blurred vision",,,,,
184,Alcoliv Tablet,allopathy,"Alcoholic fatty liver disease, Alcohol intoxication, Preventing liver damage from alcohol","Metadoxine, 500mg, Antioxidant, Hepatoprotective agent","Nausea,Upset stomach,Diarrhea",,,,,
185,Amlosafe TM 40 Tablet,allopathy,"Hypertension, High blood pressure, Angina, Reducing risk of heart attack and stroke","Telmisartan, 40mg, Amlodipine, Angiotensin II receptor antagonist, Calcium channel blocker","Sleepiness,Ankle swelling,Headache,Flushing (sense of warmth in the face, ears, neck and trunk),Dizziness,Tiredness,Palpitations,Upset stomach,Increased potassium level in blood",,,,,
186,Apetamin Syrup,allopathy,"Symptoms of allergies, Itching, Runny nose, Sneezing, Watery eyes, Allergic skin conditions, Urticaria, Angioedema, Appetite stimulant","Cyproheptadine, Antihistamine, Anti-serotonin",Increased appetite,,,,,
187,Ascovent -SR Tablet,allopathy,"Asthma, Chronic Obstructive Pulmonary Disease, COPD, Bronchitis, Thinning and loosening phlegm, Improving breathing","Acebrophylline, 100mg, Bronchodilator, Mucolytic","Nausea,Headache,Vomiting,Upset stomach,Restlessness",,,,,
188,Acupat Ophthalmic Solution,allopathy,"Itchiness in the eyes caused by allergies, Redness, Pain, Swelling after eye surgery","Ketorolac, 0.4% w/v, Olopatadine, 0.1% w/v, NSAID, Antihistamine","Burning sensation,Eye discomfort,Eye pain,Eye irritation,Dry nose,Headache,Taste change",,,,,
189,Atropine 1% Eye Drop,allopathy,"Mydriasis (Pupil dilation), Cycloplegia (Paralysis of ciliary muscle), Refraction, Treatment of uveitis/iritis, Amblyopia (patching alternative)","Atropine sulphate, 1% (Likely), Anticholinergic, Mydriatic, Cycloplegic","Eye pain,Stinging sensation,Blurred vision,High blood pressure,Increased heart rate",,,,,
190,Alamin Injection,allopathy,"Vitamin B12 deficiency, Anemia, Fatigue, Numbness or tingling in hands and feet, Nerve problem regeneration","Methylcobalamin, Mecobalamin, Vitamin B12",No common side effects seen,,,,,
191,Arbitel-AM Tablet,allopathy,"High blood pressure, Hypertension, Angina (for Amlodipine component), Reducing risk of heart attack and stroke","Amlodipine, Telmisartan, Calcium channel blocker, Angiotensin II receptor antagonist","Sleepiness,Ankle swelling,Headache,Flushing (sense of warmth in the face, ears, neck and trunk),Dizziness,Tiredness,Palpitations,Upset stomach,Increased potassium level in blood",,,,,
192,Aprecap 125/80 Capsule,allopathy,Prevention of nausea and vomiting caused by chemotherapy (CINV),"Aprepitant, 125mg/80mg capsules, Anti-emetic, Neurokinin-1 receptor antagonist","Constipation,Indigestion,Headache,Tiredness,Loss of appetite,Hiccup,Increased liver enzymes",,,,,
193,AB Phylline Syrup,allopathy,"Asthma, Chronic Obstructive Pulmonary Disease, COPD, Bronchitis, Thinning mucus, Widening airways","Acebrophylline, 10mg/ml, Mucolytic, Bronchodilator","Nausea,Headache,Vomiting,Upset stomach,Restlessness",,,,,
194,Azeflo FT Nasal Spray,allopathy,"Allergic rhinitis, Hay fever, Nasal congestion, Sneezing, Runny nose (Specific use for 'FT' may relate to a specific dosing/delivery)","Azelastine, Fluticasone (Likely combination), Antihistamine, Corticosteroid","Taste change,Headache,Nosebleeds",,,,,
195,Amicline Plus Tablet,allopathy,"Intestinal amoebiasis, Extraintestinal amoebiasis, Amoebic dysentery, Diarrhea due to amoebic etiology, Giardiasis, Asymptomatic cyst passers","Ornidazole, Diloxanide (Often in combination for amoebiasis)","Nausea,Loss of appetite,Flatulence,Dizziness,Headache",,,,,
196,Triphala Churna,Ayurvedic (Churna),"Constipation, Indigestion, Colon cleanse, Eye health, Detox.","Amalaki, Haritaki, Bibhitaki.",Mild purgative; may cause loose stools or gas initially.,,,,,
197,Sitopaladi Churna,Ayurvedic (Churna),"Cough, Cold, Bronchitis, Respiratory tract infections, Immunity.","Sitopala (Sugar candy), Vanshalochan, Pippali, Ela, Twak.",High sugar content; caution for diabetics.,,,,,
198,Hingwastak Churna,Ayurvedic (Churna),"Flatulence, Bloating, Indigestion, Loss of appetite.","Hing (Asafoetida), Trikatu (Ginger, Black/Long Pepper), Saindhava Lavana.",May cause slight acidity or burning sensation in high doses.,,,,,
199,Trikatu Churna,Ayurvedic (Churna),"Enhances metabolism (Agni), Digestive disorders, Cold, Respiratory.","Shunthi (Dried Ginger), Maricha (Black Pepper), Pippali (Long Pepper).",Pungent; excessive use can cause hyperacidity or burning.,,,,,
200,Ashwagandha Churna,Ayurvedic (Churna),"Stress, Anxiety, General debility, Promotes sleep, Tonic.",Dried root powder of Ashwagandha (Withania somnifera).,High doses may cause drowsiness or gastric upset. Consult Vaidya if hyperthyroid.,,,,,
201,Shatavari Churna,Ayurvedic (Churna),"Female tonic, Lactation support, Acidity, Ulcers, General debility.",Dried root powder of Shatavari (Asparagus racemosus).,Generally safe; may cause weight gain due to sweet nature.,,,,,
202,Brahmi Churna,Ayurvedic (Churna),"Memory enhancer, Stress, Anxiety, Cognitive function, Insomnia.",Powder of Brahmi (Bacopa monnieri or Centella asiatica).,May cause mild gastrointestinal upset or nausea.,,,,,
203,Avipattikar Churna,Ayurvedic (Churna),"Hyperacidity, Severe constipation, Heartburn.","Triphala, Trikatu, Ela, Lavanga, Haritaki, Mishri (Sugar candy).",Strong laxative effect; prolonged use is discouraged due to dependency.,,,,,
204,Punarnava Churna,Ayurvedic (Churna),"Diuretic, Oedema (swelling), Liver disorders, Kidney support.",Root powder of Punarnava (Boerhavia diffusa).,Diuretic effect; ensure hydration. Avoid if blood pressure is very low.,,,,,
205,Lavana Bhaskar Churna,Ayurvedic (Churna),"Indigestion, Loss of appetite, Splenomegaly, Abdominal gas.","Saindhava Lavana, Black Salt, Amla, Pippali, etc.",High salt content; caution for hypertensive patients.,,,,,
206,Dashamularishta,Ayurvedic (Arishta),"Post-delivery care, General debility, Inflammatory conditions, Vata imbalance.","Dashamula (Ten roots), Jaggery, Honey, Pippali, etc.","Due to self-generated alcohol, consume as advised. May cause mild gastric irritation.",,,,,
207,Ashokarishta,Ayurvedic (Arishta),"Female reproductive disorders, Menstrual pain, Excessive bleeding, Leucorrhoea.","Ashoka bark (Saraca asoca), Jaggery, Dhataki, Musta, Triphala.",May delay the menstrual cycle if taken improperly.,,,,,
208,Ashwagandharishta,Ayurvedic (Arishta),"Anxiety, Stress, General weakness, Nervous disorders, Sleeplessness.","Ashwagandha root, Jaggery, Musli, Manjistha, Honey, etc.",May cause mild gastric distress or drowsiness.,,,,,
209,Abhayarishta,Ayurvedic (Arishta),"Constipation, Piles (Haemorrhoids), Fissures, Anal prolapse.","Haritaki (Abhaya), Vidanga, Madhuka, Draksha, Jaggery.",Mild laxative; generally well-tolerated.,,,,,
210,Arjunarishta,Ayurvedic (Arishta),"Cardiac tonic, Angina, Hypertension, Respiratory diseases.","Arjuna bark (Terminalia arjuna), Draksha, Madhuka, Jaggery.",Generally safe. Consult a physician if taking modern heart medications.,,,,,
211,Drakshasava,Ayurvedic (Asava),"General weakness, Anorexia, Insomnia, Constipation.","Draksha (Raisins), Jaggery, Priyangu, Ela.","Safe; due to high sugar/raisin content, caution for diabetics.",,,,,
212,Lohasava,Ayurvedic (Asava),"Anemia (Pandu), Liver and Spleen disorders, Edema.","Purified Loha (Iron) Bhasma, Trikatu, Triphala, Jaggery.","May cause constipation, dark stools, or gastric irritation (common with Iron supplements).",,,,,
213,Khadirarishta,Ayurvedic (Arishta),"Skin diseases, Blood purification, Fungal infections, Tumors.","Khadira bark, Triphala, Dhataki, Jaggery.",Generally safe.,,,,,
214,Punarnavasava,Ayurvedic (Asava),"Liver and Kidney disorders, Edema, Anemia.","Punarnava, Shunti, Pippali, Maricha, Jaggery.",Diuretic effect; ensure hydration.,,,,,
215,Pippalyasava,Ayurvedic (Asava),"Digestive impairment, Diarrhea, Piles, Liver disorders.","Pippali, Maricha, Chavya, Jaggery.",May increase Pitta (body heat/acidity).,,,,,
216,Chandraprabha Vati,Ayurvedic (Vati),"Urinary tract infections (UTI), Diabetes, Gout, Female reproductive health.","Shilajit, Guggulu, Musta, Haridra, Vacha, and many others (37 ingredients).",Generally safe; should be avoided in severe kidney impairment.,,,,,
217,Yogaraja Guggulu,Ayurvedic (Vati),"Arthritis, Joint pain, Vata disorders, Inflammatory conditions.","Guggulu, Triphala, Trikatu, Musta, Vidanga, etc.",May cause mild gastric distress or acid reflux.,,,,,
218,Triphala Guggulu,Ayurvedic (Vati),"Piles, Fistula, Fissures, Constipation, Detox.","Guggulu, Triphala, Pippali.",Laxative effect. Caution with bleeding disorders.,,,,,
219,Arogyavardhini Vati,Ayurvedic (Vati),"Liver disorders, Jaundice, Indigestion, Skin diseases.","Shuddha Parada, Shuddha Gandhaka, Loha Bhasma, Abhraka Bhasma, Triphala, Kutaki.",Contains heavy metals; must be taken under strict medical supervision.,,,,,
220,Mahasudarshan Vati,Ayurvedic (Vati),"Acute and Chronic Fever, Cold, Cough, Body ache.","Swertia chirata, Trikatu, Musta, Indrayava, etc.",Generally safe; large doses may cause mild nausea.,,,,,
221,Tankan Bhasma Vati,Ayurvedic (Vati/Bhasma),"Cough, Bronchitis, Common cold, Digestive issues.",Tankan (Borax) Bhasma.,Overuse can lead to systemic toxicity; strict medical guidance is essential.,,,,,
222,Laxmi Vilas Ras (Naradiya),Ayurvedic (Ras),"Fever, Cold, Skin diseases, Cardiac conditions.","Abhrak Bhasma, Purified Rasa (Mercury), Gandhak (Sulphur), Loha Bhasma, etc.",Contains heavy metals; must be taken under strict medical supervision.,,,,,
223,Kaisora Guggulu,Ayurvedic (Vati),"Gout, Joint pain, Skin diseases, Blood purifier.","Guggulu, Guduchi, Triphala, Trikatu, Vidanga.",May cause mild gastric upset.,,,,,
224,Sanjivani Vati,Ayurvedic (Vati),"Fever with associated digestive problems, Indigestion, Diarrhea.","Purified Vatsanabha, Vidanga, Shunthi, Pippali, Triphala.",Contains Vatsanabha (Aconite); must be taken under strict medical supervision.,,,,,
225,Sarivadi Vati,Ayurvedic (Vati),"Ear diseases, Tinnitus, Deafness, Pitta-related disorders.","Sariva, Yashtimadhu, Cinnamon, Tamalpatra, Ela, Loha Bhasma.",Generally safe; follow dosage precisely.,,,,,
226,Chyawanprash,Ayurvedic (Avaleha),"General health tonic, Immunity booster, Respiratory health, Rasayana.","Amla, Ghee, Honey, Sesame oil, and 40-50 other herbs.",Diabetics must use sugar-free variant. Excessive consumption may cause indigestion.,,,,,
227,Agastya Haritaki Rasayana,Ayurvedic (Avaleha),"Chronic cough, Asthma, Bronchitis, Respiratory allergies.","Haritaki, Dashamula, Pippali, Vasa, Honey, Jaggery.",Generally safe; high sugar content.,,,,,
228,Vasavaleha,Ayurvedic (Avaleha),"Wet cough, Hemoptysis (blood in sputum), Bleeding disorders.","Vasa (Adhatoda vasica), Ghee, Honey, Pippali.",Generally safe.,,,,,
229,Brahma Rasayana,Ayurvedic (Avaleha),"Brain tonic, Stress, Memory, Anti-aging (Rasayana).","Amla, Haritaki, Dashamula, Bala, Pippali, Ghee, Sesame oil.",Safe for long-term use as a tonic.,,,,,
230,Kushmandaka Rasayana,Ayurvedic (Avaleha),"Weakness, Weight gain, Tuberculosis, Bleeding disorders.","Kushmanda (Ash Gourd), Ghee, Honey, Sugar, Trikatu, etc.",Generally safe. Use with caution in diabetic patients.,,,,,
231,Brahmi Ghrita,Ayurvedic (Ghrita),"Brain tonic, Memory, Insomnia, Anxiety, Seizures.","Brahmi juice, Mandukaparni, Keshara, Ghee.",High calorie/fat content. Use cautiously in high cholesterol/obesity.,,,,,
232,Panchagavya Ghrita,Ayurvedic (Ghrita),"Mental disorders, Seizures, Jaundice, Fever.","Cow milk, Cow urine, Cow dung juice, Curd, Ghee, and selected herbs.",Generally safe; high fat content.,,,,,
233,Phala Ghrita,Ayurvedic (Ghrita),"Female infertility, Uterine disorders, Improves conception.","Shatavari, Ashwagandha, Kushmanda, Yashtimadhu, Ghee.",Generally safe; usually taken before conception.,,,,,
234,Tikta Ghrita,Ayurvedic (Ghrita),"Chronic skin diseases, Psoriasis, Gout, Blood purification.","Katuki, Neem, Patola, Triphala, Ghee.",Very bitter taste. May cause mild nausea or loose stools if taken in excess.,,,,,
235,Indukanta Ghrita,Ayurvedic (Ghrita),"General debility, Recurrent fever, Vata disorders.","Indukanta (Moon), Ghee.",Safe for internal consumption. High fat content.,,,,,
236,Mahanarayana Taila,Ayurvedic (Taila),"Joint pain, Arthritis, Osteoarthritis, Paralysis (external application).","Til Taila base, Bilva, Ashwagandha, Shalparni, Manjistha, Shatavari.",Generally safe for external use.,,,,,
237,Ksheerabala Taila,Ayurvedic (Taila),"Neurological disorders, Insomnia, Vata imbalances (external/internal).","Bala (Sida cordifolia), Cow's Milk, Sesame Oil.",Generally safe. Internal consumption should be as advised.,,,,,
238,Neelibhringadi Taila,Ayurvedic (Taila),"Hair fall, Dandruff, Premature graying, Head cooling.","Nili (Indigofera tinctoria), Bhringaraja, Amla, Coconut/Sesame Oil base.",Safe for external use.,,,,,
239,Narayana Taila,Ayurvedic (Taila),"Joint pain, Stiffness, Paralysis, Musculoskeletal issues.","Similar to Mahanarayana Taila, a variant formulation.",Safe for external use.,,,,,
240,Shilajit,Ayurvedic (Rasayana),"Vigor and vitality, Chronic fatigue, Urinary/Kidney health.","Exudate from Himalayan rocks (mineral pitch), processed.",May cause hyperuricemia or increased body heat. Caution for Gout.,,,,,
241,Makardhwaj Vati,Ayurvedic (Ras),"Aphrodisiac, Energy, Chronic weakness, Male sexual health.","Gold, Mercury (Rasa), Sulphur (Gandhaka), all purified.",Contains heavy metals; must be taken under strict medical supervision.,,,,,
242,Rajata Bhasma,Ayurvedic (Bhasma),"Nervous disorders, Memory, Insomnia, Cardiac tonic.",Calcined Ash of Silver (Rajata).,Contains a heavy metal; must be taken under strict medical supervision.,,,,,
243,Rasnasaptakam Kashaya,Ayurvedic (Kwath),"Joint pain, Backache, Arthritis, Inflammatory disorders.","Rasna, Bala, Eranda, Devadaru, Punarnava, Guduchi, Shunthi.",Generally safe; bitter taste.,,,,,
244,Amrutharishtam,Ayurvedic (Kwath),"Recurrent fevers, Immune booster, Detoxifier.","Amritha (Guduchi), Dashamula, Jaggery.",Generally safe.,,,,,
245,Indukantham Kwath,Ayurvedic (Kwath),"Chronic fever, Abdominal pain, General weakness.","Putikaranja, Devadaru, Bilva, Agnimantha, Ghee.",Safe for consumption.,,,,,
246,Citalopram (Celexa),Selective Serotonin Reuptake Inhibitor,"Major Depressive Disorder, panic disorder, obsessive-compulsive disorder (OCD), anxiety",Citalopram HBr,"Nausea, dry mouth, sleep issues, drowsiness, excessive sweating, sexual side effects, restlessness",,,,,
247,Escitalopram (Lexapro),Selective Serotonin Reuptake Inhibitor,"Major Depressive Disorder, Generalized Anxiety Disorder, OCD",Escitalopram oxalate,"Nausea, fatigue, sleepiness, sleep issues, dry mouth, sexual side effects, headache",,,,,
248,"Fluoxetine (Prozac, Sarafem)",Selective Serotonin Reuptake Inhibitor,"Major Depressive Disorder, OCD, panic disorder, bulimia nervosa, Premenstrual Dysphoric Disorder (PMDD)",Fluoxetine hydrochloride,"Sleep issues, nervousness, anxiety, nausea, diarrhea, loss of appetite, sexual side effects",,,,,
249,"Paroxetine (Paxil, Pexeva)",Selective Serotonin Reuptake Inhibitor,"Major Depressive Disorder, OCD, panic disorder, anxiety, Posttraumatic Stress Disorder (PTSD), PMDD",Paroxetine hydrochloride,"Nausea, drowsiness, weakness, headache, sleep issues, sexual side effects",,,,,
250,Sertraline (Zoloft),Selective Serotonin Reuptake Inhibitor,"Major Depressive Disorder, OCD, panic disorder, PTSD, PMDD, social anxiety disorder",Sertraline hydrochloride,"Nausea, diarrhea, sleepiness, sleep issues, headache, dry mouth, sexual side effects",,,,,
251,Fluvoxamine (Luvox),Selective Serotonin Reuptake Inhibitor,"OCD, social anxiety disorder",Fluvoxamine maleate,"Nausea, sleepiness, sleep issues, dry mouth, headache, nervousness",,,,,
252,Vilazodone (Viibryd),Selective Serotonin Reuptake Inhibitor,Major Depressive Disorder,Vilazodone,"Diarrhea, nausea, vomiting, sleep issues, dizziness, fatigue, dry mouth",,,,,
253,"Desvenlafaxine (Pristiq, Khedezla)",Serotonin and Norepinephrine Reuptake Inhibitor,Major Depressive Disorder,Desvenlafaxine,"Nausea, dizziness, sleep issues, sweating, dry mouth, constipation, sexual side effects",,,,,
254,Duloxetine (Cymbalta),Serotonin and Norepinephrine Reuptake Inhibitor,"Major Depressive Disorder, Generalized Anxiety Disorder, nerve pain, fibromyalgia",Duloxetine hydrochloride,"Nausea, dry mouth, constipation, fatigue, sleep issues, loss of appetite",,,,,
255,Levomilnacipran (Fetzima),Serotonin and Norepinephrine Reuptake Inhibitor,Major Depressive Disorder,Levomilnacipran,"Nausea, constipation, sweating, heart rate increase, dizziness, sexual side effects",,,,,
256,Venlafaxine (Effexor XR),Serotonin and Norepinephrine Reuptake Inhibitor,"Major Depressive Disorder, Generalized Anxiety Disorder, panic disorder, social anxiety disorder",Venlafaxine hydrochloride,"Nausea, dry mouth, sleep issues, headache, constipation, sexual side effects, dizziness",,,,,
257,Bupropion (Wellbutrin),Atypical Antidepressant,"Major Depressive Disorder, Seasonal Affective Disorder (SAD), nicotine withdrawal",Bupropion hydrochloride,"Sleep issues, dry mouth, headache, nausea, constipation, dizziness, agitation",,,,,
258,Mirtazapine (Remeron),Atypical Antidepressant,Major Depressive Disorder,Mirtazapine,"Sleepiness, increased appetite, weight gain, dry mouth, constipation, dizziness",,,,,
259,Trazodone (Desyrel),Atypical Antidepressant,Major Depressive Disorder,Trazodone hydrochloride,"Sleepiness, dizziness, nausea, dry mouth, headache, fatigue",,,,,
260,Vortioxetine (Trintellix),Atypical Antidepressant,Major Depressive Disorder,Vortioxetine,"Nausea, constipation, vomiting, dizziness, sexual side effects",,,,,
261,Esketamine (Spravato),Atypical Antidepressant,Treatment-resistant depression (nasal spray),Esketamine,"Dissociation, dizziness, nausea, vertigo, anxiety, sleepiness, elevated blood pressure",,,,,
262,Amitriptyline (Elavil),Tricyclic Antidepressant,"Major Depressive Disorder, anxiety, nerve pain, headaches",Amitriptyline hydrochloride,"Drowsiness, dry mouth, blurred vision, constipation, weight gain, dizziness, low blood pressure",,,,,
263,Nortriptyline (Pamelor),Tricyclic Antidepressant,Major Depressive Disorder,Nortriptyline hydrochloride,"Dry mouth, constipation, dizziness, drowsiness, blurred vision, weight gain",,,,,
264,Imipramine (Tofranil),Tricyclic Antidepressant,"Major Depressive Disorder, panic disorder, childhood bedwetting",Imipramine hydrochloride,"Dry mouth, blurred vision, constipation, drowsiness, dizziness, sweating, weight gain",,,,,
265,Doxepin (Silenor),Tricyclic Antidepressant,"Major Depressive Disorder, anxiety, sleep issues",Doxepin hydrochloride,"Drowsiness, dry mouth, blurred vision, constipation, weight gain, low blood pressure",,,,,
266,Clomipramine (Anafranil),Tricyclic Antidepressant,OCD,Clomipramine hydrochloride,"Drowsiness, dry mouth, constipation, dizziness, fatigue, weight gain, sexual side effects",,,,,
267,Phenelzine (Nardil),Monoamine Oxidase Inhibitor,Major Depressive Disorder (when other treatments fail),Phenelzine sulfate,"Dizziness, headache, sleep issues, drowsiness, dry mouth, sexual side effects, weight gain",,,,,
268,Tranylcypromine (Parnate),Monoamine Oxidase Inhibitor,Major Depressive Disorder (when other treatments fail),Tranylcypromine sulfate,"Dizziness, sleep issues, restlessness, dry mouth, sexual side effects, headache, weight gain",,,,,
269,Isocarboxazid (Marplan),Monoamine Oxidase Inhibitor,Major Depressive Disorder (when other treatments fail),Isocarboxazid,"Dizziness, sleep issues, headache, sexual side effects, dry mouth, blurred vision",,,,,
270,"Selegiline (Emsam, Eldepryl)",Monoamine Oxidase Inhibitor,"Major Depressive Disorder, Parkinson's disease",Selegiline hydrochloride,"Skin irritation (patch), nausea, dry mouth, dizziness, sleep issues",,,,,
271,Aripiprazole (Abilify),"Second-generation Antipsychotic, D2 partial agonist(Medications for brain disorders)","Schizophrenia, bipolar disorder, Tourette's syndrome, irritability associated with autism",Aripiprazole,"Nausea, vomiting, akathisia (restlessness), dizziness, insomnia, sedation, weight gain",,,,,
272,Chlorpromazine (Thorazine),"First-generation Antipsychotic (Phenothiazine), D2 antagonist(Medications for brain disorders)","Psychotic disorders, agitation, nausea, chronic hiccups",Chlorpromazine,"Dry mouth, sleepiness, constipation, extrapyramidal symptoms, weight gain",,,,,
273,Haloperidol (Haldol),"First-generation Antipsychotic (Butyrophenone), D2 antagonist(Medications for brain disorders)","Schizophrenia, Tourette's syndrome, severe behavioral disorders in children",Haloperidol,"Extrapyramidal symptoms, agitation, restlessness, tardive dyskinesia, drowsiness, dry mouth",,,,,
274,Quetiapine (Seroquel),"Second-generation Antipsychotic, Serotonin-Dopamine Antagonist(Medications for brain disorders)","Schizophrenia, bipolar disorder",Quetiapine,"Somnolence, dizziness, dry mouth, constipation, weight gain",,,,,
275,Risperidone (Risperdal),Second-generation Antipsychotic (Benzisoxazole derivative)(Medications for brain disorders),"Schizophrenia, bipolar disorder, irritability in autism",Risperidone,"Weight gain, drowsiness, extrapyramidal symptoms, dry mouth, constipation",,,,,
276,"Xanomeline/Trospium (Cobenfy, KarXT)",Novel Antipsychotic (Muscarinic Agonist/Antagonist)(Medications for brain disorders),Schizophrenia,Xanomeline and Trospium Chloride,"Nausea, constipation, dry mouth, vomiting, dizziness",,,,,
277,Lithium (Lithobid),"Mood Stabilizer, Monovalent Cation(Medications for brain disorders)",Bipolar disorder,Lithium carbonate,"Nausea, vomiting, hand tremors, increased thirst, urination, weight gain",,,,,
278,Carbamazepine (Tegretol),"Anticonvulsant, Mood Stabilizer(Medications for brain disorders)","Bipolar disorder, seizures, trigeminal neuralgia",Carbamazepine,"Dizziness, drowsiness, nausea, constipation, loss of balance",,,,,
279,Lamotrigine (Lamictal),"Anticonvulsant, Mood Stabilizer(Medications for brain disorders)","Bipolar disorder, seizures (epilepsy)",Lamotrigine,"Dizziness, drowsiness, headache, nausea, rash (including severe rashes like SJS)",,,,,
280,Valproic Acid (Depakote),"Anticonvulsant, Mood Stabilizer(Medications for brain disorders)","Bipolar disorder, seizures",Valproic acid (as divalproex sodium or sodium valproate),"Nausea, vomiting, diarrhea, tremors, weight gain, hair loss",,,,,
281,Alprazolam (Xanax),"Benzodiazepine, GABA-A receptor agonist(Medications for brain disorders)","Anxiety, panic disorder",Alprazolam,"Sedation, drowsiness, memory impairment, dizziness, fatigue",,,,,
282,Lorazepam (Ativan),"Benzodiazepine, GABA-A receptor agonist(Medications for brain disorders)","Anxiety, seizures",Lorazepam,"Sedation, drowsiness, fatigue, dizziness, muscle weakness",,,,,
283,Clonazepam (Klonopin),"Benzodiazepine, GABA-A receptor agonist(Medications for brain disorders)","Seizure disorders, panic disorder",Clonazepam,"Drowsiness, dizziness, unsteadiness, problems with coordination",,,,,
284,Methylphenidate (Ritalin),"CNS Stimulant, Dopamine and Norepinephrine Reuptake Inhibitor(Medications for brain disorders)","ADHD, narcolepsy",Methylphenidate,"Headache, insomnia, nervousness, abdominal pain, loss of appetite",,,,,
285,Lisdexamfetamine (Vyvanse),"CNS Stimulant, Prodrug of Dextroamphetamine(Medications for brain disorders)","ADHD, binge eating disorder",Lisdexamfetamine dimesylate,"Loss of appetite, insomnia, dry mouth, anxiety, weight loss",,,,,
286,Donepezil (Aricept),Cholinesterase Inhibitor(Medications for brain disorders),Alzheimer's disease,Donepezil hydrochloride,"Nausea, vomiting, diarrhea, insomnia, dizziness",,,,,
287,Galantamine (Razadyne),Cholinesterase Inhibitor(Medications for brain disorders),Alzheimer's disease,Galantamine hydrobromide,"Nausea, vomiting, diarrhea, dizziness, headache",,,,,
288,Rivastigmine (Exelon),Cholinesterase Inhibitor(Medications for brain disorders),"Alzheimer's disease, dementia associated with Parkinson's disease",Rivastigmine (tartrate),"Nausea, vomiting, diarrhea, dizziness, headache",,,,,
289,Memantine (Namenda),NMDA Receptor Antagonist(Medications for brain disorders),Moderate to severe Alzheimer's disease,Memantine hydrochloride,"Dizziness, headache, confusion, constipation",,,,,
