,Name,Type ,Uses,Content,Side Effects,EAN,,,,
384,Endoxan N 1000mg Injection,allopathy,"Various cancers (Lymphoma, Leukaemia, Breast Cancer, Ovarian Cancer), Severe autoimmune conditions (Requires professional administration)","Cyclophosphamide (1000mg), Alkalylating agent, Immunosuppressant","Vomiting,Nausea,Hair loss,Fever,Blood in urine,Diarrhea,Decreased white blood cell count (neutrophils)",,,,,
385,Ephrilime 7.5 mg/2 mg Syrup,allopathy,"Productive cough, Bronchitis, Asthma, COPD, Loosening thick mucus, Widening airways","Ambroxol (7.5mg/dose), Salbutamol (2mg/dose), Mucolytic, Bronchodilator","Nausea,Vomiting,Constipation,Sleepiness,Lightheadedness,Dizziness,Breathlessness,Sweating",,,,,
386,Epo 150 Tablet SR,allopathy,"Diabetic neuropathy, Diabetic nerve pain, Preventing accumulation of sorbitol in nerves","Epalrestat (Likely 150mg Sustained Release), Aldose reductase inhibitor","Nausea,Vomiting,Abnormal liver function",,,,,
387,Eflo 0.1% Eye Ointment,allopathy,"Corticosteroid-responsive inflammation of the eye, Reducing swelling, Redness, and pain in the eye","Fluorometholone (0.1% w/w), Corticosteroid","Eye irritation,Burning sensation,Watery eyes",,,,,
388,Enoxatroy 60mg/0.6ml Injection,allopathy,"Prevention and treatment of Deep Vein Thrombosis (DVT), Pulmonary Embolism (PE), Preventing blood clots (Requires clinical context)","Enoxaparin Sodium (60mg/0.6ml), Low Molecular Weight Heparin","Bleeding,Headache,Increased blood platelets,Increased liver enzymes",,,,,
389,Endothik ES 2 mg/25 mg Tablet,allopathy,"Hormone Replacement Therapy (HRT), Menopausal symptoms (hot flashes, vaginal dryness), Osteoporosis prevention (Requires clinical context for 'ES 25 mg' component)","Estradiol (2mg), Drospirenone (Likely 25mg if an HRT product, or other component), Estrogen, Progestin/Diuretic","Diarrhea,Nausea,Stomach pain,Indigestion,Headache,Nosebleeds,Breast pain,Flushing (sense of warmth in the face, ears, neck and trunk),Pain in extremity",,,,,
390,Equisulin R Injection,allopathy,"Diabetes mellitus (Type I & II), Improving glycemic control, Lowering blood glucose levels, Post-meal sugar control","Human Insulin (Likely 40IU/ml or 100IU/ml), Short-acting insulin","Hypoglycemia (low blood glucose level),Injection site allergic reaction",,,,,
391,Eysol 0.7% Eye Drop,allopathy,"Dry eyes, Relieving irritation, Burning, and discomfort due to eye dryness","Hydroxypropylmethylcellulose (0.7% w/v), Ophthalmic lubricant, Artificial tears","Blurred vision,Eye irritation,Eye pain,Eye redness,Foreign body sensation in eyes",,,,,
392,Eva Q Fiber Granules,allopathy,"Constipation, Alleviating infrequent and difficult bowel movements, Promoting regularity","Ispaghula (Bulk-forming laxative), Lactitol (Osmotic laxative), Combination laxative","Bloating,Stomach cramp,Flatulence",,,,,
393,Ebexid B  Tablet,allopathy,"Hypothyroidism (Underactive thyroid), Supporting thyroid function, Addressing nutritional deficiencies, Supporting metabolism","Nicotinamide (Vitamin B3), Thyroxine (Thyroid Hormone), Pyridoxine (Vitamin B6) (Likely as a supplement combination)","Anxiety,Vomiting,Palpitations,Diarrhea,Nervousness,Weight loss,Tremor",,,,,
394,Etoplast 50mg Capsule,allopathy,"Various cancers, Testicular cancer, Small cell lung cancer, Acute myeloid leukaemia, Ovarian cancer, Lymphoma, Preventing growth/spread of cancer cells","Etoposide (50mg), Chemotherapy drug, Topoisomerase inhibitor","Anemia (low number of red blood cells),Decreased blood cells (red cells, white cells, and platelets),Decreased white blood cell count,Diarrhea,Hair loss,Liver damage,Low blood platelets,Nausea,Rash,Stomatitis (Inflammation of the mouth),Vomiting",,,,,
395,Femoral 60mg Tablet,allopathy,"Treatment and prevention of postmenopausal osteoporosis, Reducing the risk of invasive breast cancer in postmenopausal women with osteoporosis","Raloxifene (60mg), Selective Estrogen Receptor Modulator, SERM","Leg cramps,Peripheral edema,Flu-like symptoms,Joint pain,Sweating,Hot flashes",,,,,
396,Folistat 5mg Tablet,allopathy,"Anemia due to folic acid deficiency, Preventing neural tube defects during pregnancy, Iron deficiency anemia","Folic Acid (5mg), Vitamin B9 supplement","Abdominal distension,Flatulence,Nausea,Weight loss",,,,,
397,Fresofol 1% Injection,allopathy,"Induction and maintenance of general anaesthesia (surgery), Sedation (mechanically ventilated ICU patients), Monitored conscious sedation","Propofol (10mg/ml), General anaesthetic","Nausea,Headache,Vomiting,Local site pain,Slow heart rate,Decreased blood pressure",,,,,
398,Forcan TZ 150mg/1000mg Tablet,allopathy,"Vaginal infections (various types), Abnormal vaginal discharge, Killing fungus and microorganisms causing infection","Fluconazole (150mg), Tinidazole (1000mg), Antifungal, Antiprotozoal","Diarrhea,Nausea,Vomiting,Stomach pain,Dryness in mouth,Metallic taste,Headache,Rash",,,,,
399,Filgen 300mcg Injection,allopathy,"Neutropenia (low white blood cell count) caused by chemotherapy, Bone marrow transplant, Severe chronic neutropenia, Reducing risk of bacterial infections","Filgrastim (300mcg), Granulocyte Colony-Stimulating Factor, G-CSF","Bone pain,Weakness,Headache,Rash,Nausea,Increased lactate dehydrogenase level in blood,Vomiting,Increased uric acid level in blood,Oropharyngeal pain,Hair loss,Fatigue,Diarrhea,Constipation,Decreased appetite,Cough,Breathing problems",,,,,
400,Firm UP 200mg Tablet,allopathy,"Female infertility, Supports early stages of pregnancy, Abnormal uterine bleeding, Menopausal disorders, Secondary amenorrhea, Threatened abortions","Progesterone (200mg), Progestin","Abdominal bloating,Abdominal pain,Dizziness,Headache,Depression,Breast tenderness,Hot flushes,Vaginal discharge,Joint pain,Urinary incontinence",,,,,
401,Fillif Peg 6mg Injection,allopathy,"Reducing risk of infection / febrile neutropenia during chemotherapy, Increasing neutrophil count","Pegfilgrastim (6mg), Pegylated Granulocyte Colony-Stimulating Factor","Bone pain,Joint pain,Headache,Nausea,Low blood platelets,Muscle pain,Back pain,Pain in extremity,Injection site pain",,,,,
402,Facidase 1500IU Injection,allopathy,"Preservative (in some combinations), Increases absorption and spread of other injected medications (solvent), Subcutaneous fluid absorption","Hyaluronidase (Likely 1500IU), Enzyme additive","Hives,Hormone imbalance,Allergic reaction,Slow growth in children and teenagers,Angioedema (swelling of deeper layers of skin),Dizziness,Injection site reaction,Edema (swelling)",,,,,
403,Folax 5mg Tablet,allopathy,"Nutritional deficiencies, Vitamin B6/B9/B12 deficiency, Managing neuropathy, Promoting red blood cell formation, Preventing anemia","Folic Acid (5mg), Methylcobalamin (1500mcg), Pyridoxine (20mg), Vitamin Supplement","Abdominal distension,Flatulence,Nausea,Weight loss",,,,,
404,Fykast-ACE Tablet,allopathy,"Prevention of asthma, Allergic symptoms (sneezing, runny nose, watery eyes), Reducing inflammation, Thinning mucus, Widening air passages","Montelukast (10mg), Levocetirizine (5mg), Acebrophylline (200mg), Leukotriene antagonist, Antihistamine, Bronchodilator/Mucolytic","Nausea,Vomiting,Diarrhea,Skin rash,Flu-like symptoms,Dryness in mouth,Headache,Fatigue,Sleepiness,Rash,Hives,Itching,Breathing problems,Increased white blood cell count",,,,,
405,Foseal 800 Tablet,allopathy,"Hyperphosphataemia (high phosphate levels) in adult patients on dialysis, Chronic kidney disease (CKD), Prevention of bone disorders","Sevelamer (800mg), Phosphate binder","Nausea,Vomiting,Upper abdominal pain,Flatulence,Constipation,Diarrhea",,,,,
406,FIONA 60 MG TABLET,allopathy,"Treatment and prevention of postmenopausal osteoporosis, Increasing bone density, Reducing risk of fractures","Raloxifene (60mg), Selective Estrogen Receptor Modulator, SERM","Leg cramps,Peripheral edema,Flu-like symptoms,Joint pain,Sweating,Hot flashes",,,,,
407,Filneon 300mcg Injection,allopathy,"Neutropenia (low white blood cell count) caused by cancer chemotherapy, Bone marrow transplant, Severe chronic neutropenia, HIV infection","Filgrastim (300mcg), Granulocyte Colony-Stimulating Factor, G-CSF","Bone pain,Weakness,Headache,Rash,Nausea,Increased lactate dehydrogenase level in blood,Vomiting,Increased uric acid level in blood,Oropharyngeal pain,Hair loss,Fatigue,Diarrhea,Constipation,Decreased appetite,Cough,Breathing problems",,,,,
408,Flumet Eye Drop,allopathy,"Corticosteroid-responsive inflammation of the eye, Treating eye conditions caused by inflammation, Reducing swelling/pain/discomfort","Fluorometholone (0.1% w/v), Corticosteroid","Eye irritation,Burning sensation,Watery eyes",,,,,
409,GI 750 mg/20 mg/250 mg Kit,allopathy,"Peptic ulcer disease caused by Helicobacter pylori (H. pylori) infection, Eradication therapy","Amoxicillin (750mg), Clarithromycin (250mg), Omeprazole (20mg), Penicillin Antibiotic, Macrolide Antibiotic, Proton Pump Inhibitor","Nausea,Diarrhea,Vomiting,Stomach pain,Taste change,Flatulence,Headache,Rash",,,,,
410,Glygest 10gm/10gm Infusion,allopathy,"Cerebral edema, Reducing intracranial pressure, Intraocular pressure (Requires clinical context)","Glycerol (Likely 10gm), Mannitol (Likely 10gm), Osmotic Diuretic",No common side effects seen,,,,,
411,Gamma I.V. 2500mg Infusion,allopathy,"Primary immunodeficiency disorders, Autoimmune diseases, Kawasaki disease, ITP, Preventing infections (Requires clinical context)","Immunoglobulin G (IVIG, likely 2.5gm), Antibody preparation","Back pain,Chills,Flushing (sense of warmth in the face, ears, neck and trunk),Dizziness,Headache,Nausea,Decreased blood pressure,Muscle pain,Slow heart rate,Wheezing",,,,,
412,GLUTAPEP INFUSION,allopathy,"Nutritional support in critically ill patients, Trauma, Burns, Surgery, Malabsorption, Preserving gut function","L-Alanyl-L-Glutamine (Dipeptide), Glutamine supplement","Folic acid deficiency,Chills,Fever,Flushing (sense of warmth in the face, ears, neck and trunk),Increased sweating,Metabolic disorder,Vomiting,Liver damage,Injection site reactions (pain, swelling, redness)",,,,,
413,Gonablok 200 Capsule,allopathy,"Endometriosis, Fibrocystic breast disease (Benign breast lumps), Hereditary angioedema","Danazol (200mg), Synthetic androgen","Hoarseness of voice,Hair loss,Weight gain,Acne,Abnormal hair growth on a women face and body,Voice change,Itchy scalp,Swelling,Sore throat",,,,,
414,Gdcit Tablet,allopathy,"Gallstones, Primary biliary cholangitis, Liver disorders (Exact combination is required for precise content/use)","Ursodeoxycholic Acid (Likely in combination), Bile Acid","Nausea,Diarrhea,Vomiting,Stomach pain,Upset stomach,Dizziness,Headache,Rash,Hives,Fatigue,Dryness in mouth,Sleepiness",,,,,
415,Granirex Injection,allopathy,Prevention and treatment of nausea and vomiting associated with chemotherapy and radiotherapy,"Granisetron (Likely 1mg/ml or similar), 5-HT3 receptor antagonist","Injection site pain,Constipation,Diarrhea,Headache,Sleepiness,Weakness",,,,,
416,Hifenac-P Tablet,allopathy,"Pain relief, Inflammation, Fever, Osteoarthritis, Rheumatoid arthritis, Back pain, Dental pain, Headache","Aceclofenac, Paracetamol / Acetaminophen, NSAID, Analgesic","Nausea,Vomiting,Stomach pain/epigastric pain,Loss of appetite,Heartburn,Diarrhea",,,,,
417,Hetrazan 100 Tablet,allopathy,"Filariasis (Worm infections: Wuchereriasis, Loiasis), Tropical Eosinophilia","Diethylcarbamazine (100mg), Antifilarial agent","Headache,Dizziness,Vomiting,Abnormal liver function tests,Nausea,Abdominal pain,Hair loss,Fever,Vertigo",,,,,
418,Hifenac-MR Tablet,allopathy,"Pain due to muscle spasms, Musculoskeletal pain, Inflammation, Reducing stiffness","Aceclofenac, Paracetamol (or other NSAID/Analgesic), Chlorzoxazone (Likely Muscle Relaxant)","Nausea,Vomiting,Heartburn,Stomach pain,Diarrhea,Loss of appetite,Tiredness,Sleepiness",,,,,
419,Headset Tablet,allopathy,"Headache, Fever, Migraine, Pain relief","Paracetamol / Acetaminophen, Propyphenazone, Caffeine (Common combination), Analgesic, CNS Stimulant","Nausea,Dizziness,Heartburn,Chest discomfort,Dryness in mouth,Weakness,Muscle stiffness,Drowsiness,Numbness of extremity,Arrhythmia (irregular heartbeats),Feeling hot",,,,,
420,Hepamerz Tablet,allopathy,"Hepatic encephalopathy (complications of liver failure), Liver disorders (Hepatitis, Cirrhosis)","L-Ornithine-L-Aspartate (LOLA), Hepatoprotective agent","Nausea,Stomach pain,Bloating,Diarrhea,Constipation",,,,,
421,HP Kit,allopathy,"Eradication of Helicobacter pylori (H. pylori), Treatment of peptic ulcers","Amoxicillin, Clarithromycin, Lansoprazole (Typical combination), Antibiotics, Proton Pump Inhibitor (PPI)","Diarrhea,Nausea,Vomiting,Stomach pain,Flatulence,Dizziness,Tiredness,Headache,Skin rash,Dryness in mouth,Metallic taste",,,,,
422,Hcg 5000IU Injection,allopathy,"Female infertility (Inducing ovulation), Male hypogonadism (Stimulating testosterone production), Undescended testicles (in boys)","Human Chorionic Gonadotropin (hCG, 5000IU), Gonadotropin Hormone","Injection site pain,Headache,Fatigue,Depression,Irritation,Restlessness",,,,,
423,Histafree-M Tablet,allopathy,"Allergic rhinitis (Seasonal and Perennial), Asthma prophylaxis, Sneezing, Runny nose, Urticaria","Levocetirizine (Antihistamine), Montelukast (Leukotriene Receptor Antagonist)","Nausea,Diarrhea,Vomiting,Skin rash,Flu-like symptoms,Headache,Drowsiness,Dizziness",,,,,
424,Irivisc Eye Drop,allopathy,"Dry eyes, Soothing irritation and burning, Lubricating the eye surface","Sodium Hyaluronate or Hydroxypropylmethylcellulose (Likely), Ophthalmic Lubricant",Stinging in the eyes,,,,,
425,Insulatard 100IU/ml Solution for Injection,allopathy,"Diabetes mellitus (Type 1 and Type 2), Long-term blood sugar control","Insulin Isophane (NPH), 100IU/ml, Intermediate-acting insulin","Hypoglycemia (low blood glucose level),Injection site allergic reaction,Lipodystrophy (skin thickening or pits at the injection site),Weight gain,Edema (swelling)",,,,,
426,Isorane Liquid For Inhalation,allopathy,Maintenance of general anaesthesia (Requires professional administration),"Isoflurane, Volatile Halogenated Anesthetic","Shivering,Vomiting,Nausea,Decreased blood pressure,High grade fever,Irregular heartbeats",,,,,
427,Insucare N 40IU/ml Injection,allopathy,"Diabetes mellitus (Type 1 and Type 2), Long-term blood sugar control (Lower unit concentration)","Insulin Isophane (NPH), 40IU/ml, Intermediate-acting insulin","Hypoglycemia (low blood glucose level),Injection site allergic reaction,Lipodystrophy (skin thickening or pits at the injection site),Weight gain,Edema (swelling)",,,,,
428,Isorane Solution,allopathy,Maintenance of general anaesthesia (Requires professional administration),"Isoflurane, Volatile Halogenated Anesthetic","Shivering,Vomiting,Nausea,Decreased blood pressure,High grade fever,Irregular heartbeats",,,,,
429,Immithal 100mg Capsule,allopathy,"Multiple myeloma, Erythema Nodosum Leprosum (ENL), Autoimmune conditions (Requires strict control/monitoring)","Thalidomide (100mg), Immunomodulator, Anti-angiogenic","Headache,Sleepiness,Nausea,Rash,Weakness,Dizziness,Edema (swelling),Loss of appetite,Decreased white blood cell count,Decreased calcium level in blood,Weight gain,Fatigue,Muscle weakness,Fever,Anxiety,Blood clots ,Dry skin,Weight loss,Confusion,Decreased white blood cell count (neutrophils),Neuropathy,Constipation,Tremor",,,,,
430,Ibicasp 50mg Injection,allopathy,"Treatment of postmenopausal osteoporosis, Reducing risk of vertebral fractures (Requires professional administration)","Ibandronate (50mg), Bisphosphonate","Chills,Decreased potassium level in blood,Diarrhea,Fever,Increased alkaline phospatase level in blood,Increased liver enzymes,Rash",,,,,
431,Inflobid NXT 500mg/200mg Tablet,allopathy,"Bacterial infections, Protozoal infections, Diarrhea, Dysentery, Gynecological infections, Urinary tract infections","Ofloxacin (500mg), Ornidazole (200mg), Quinolone Antibiotic, Antiprotozoal","Vomiting,Headache,Stomach pain,Nausea",,,,,
432,Junior Lanzol 15mg Tablet DT,allopathy,"Gastroesophageal Reflux Disease (GERD), Erosive esophagitis, Peptic ulcers, Zollinger-Ellison syndrome, Acidity (Often for pediatric/junior use)","Lansoprazole (15mg), Proton Pump Inhibitor (PPI)","Nausea,Headache,Flatulence,Diarrhea",,,,,
433,Jardiance 25mg Tablet,allopathy,"Type 2 diabetes mellitus, Improving glycemic control, Reducing risk of cardiovascular death in high-risk patients","Empagliflozin (25mg), SGLT2 Inhibitor","Nausea,Frequent urge to urinate,Increased thirst,Urinary tract infection,Hypoglycemia (low blood glucose level)",,,,,
434,Janumet 50mg/1000mg Tablet,allopathy,"Type 2 diabetes mellitus, Improving blood sugar control (Used with diet and exercise)","Sitagliptin (50mg), Metformin (1000mg), DPP-4 Inhibitor, Biguanide","Diarrhea,Nausea,Vomiting,Upset stomach,Headache,Nasal congestion (stuffy nose),Sore throat,Respiratory tract infection,Hypoglycaemia (low blood sugar level) in combination with insulin or sulphonylurea",,,,,
435,Januvia 100mg Tablet,allopathy,"Type 2 diabetes mellitus, Improving blood sugar control (Used with diet and exercise)","Sitagliptin (100mg), DPP-4 Inhibitor","Headache,Hypoglycaemia (low blood sugar level) in combination with insulin or sulphonylurea,Upper respiratory tract infection,Nasopharyngitis (inflammation of the throat and nasal passages)",,,,,
436,Jalra-M  50mg/500mg Tablet,allopathy,"Type 2 diabetes mellitus, Improving blood sugar control (Used with diet and exercise)","Vildagliptin (50mg), Metformin (500mg), DPP-4 Inhibitor, Biguanide","Nausea,Vomiting,Diarrhea,Stomach pain,Loss of appetite,Dizziness,Headache,Trembling,Metallic taste,Hypoglycemia (low blood glucose level)",,,,,
437,K Pot 150mg Injection,allopathy,"Hypokalemia (Low potassium levels), Maintaining electrolyte balance (Requires professional administration)","Potassium Chloride (Likely 150mg/dose), Electrolyte Supplement","Injection site reactions (pain, swelling, redness),Muscle weakness,Paresthesia (tingling or pricking sensation),Nausea",,,,,
438,Ketalar 50mg/ml Injection,allopathy,"General anaesthesia, Sedation (diagnostic/surgical procedures), Acute pain management (Requires professional administration)","Ketamine (50mg/ml), Dissociative Anesthetic","Rash,Erythema (skin redness),Vomiting,Nausea,Agitation,Nightmare,Abnormal behavior,Double vision,Hallucination,Increased respiratory rate ,High blood pressure,Confusion,Nystagmus (involuntary eye movement),Muscle coordination impaired,Tonic-clonic seizures,Tachycardia",,,,,
439,K-Lot Oral Solution,allopathy,"Hypokalemia (Low potassium levels), Prevention of potassium deficiency","Potassium Chloride (Often in a liquid form), Electrolyte Supplement","Flatulence,Abdominal pain,Diarrhea,Nausea,Vomiting",,,,,
440,Klog 10mg Injection,allopathy,"Controlling/preventing excessive bleeding in various conditions (e.g., surgery, trauma, heavy menstrual bleeding)","Tranexamic Acid (Likely 10mg/ml or similar), Antifibrinolytic","Injection site reactions (pain, swelling, redness)",,,,,
441,Levolin 1mg Syrup,allopathy,"Asthma, Chronic Obstructive Pulmonary Disease (COPD), Wheezing, Shortness of breath, Reversible airway obstruction","Levosalbutamol (1mg/5ml likely), Bronchodilator","Tremor,Headache,Palpitations,Increased heart rate,Muscle cramp",,,,,
442,Levoflox 500 Tablet,allopathy,"Bacterial infections (Respiratory tract, Urinary tract, Skin, Sinus, Prostate), Pneumonia, Bronchitis","Levofloxacin (500mg), Fluoroquinolone Antibiotic","Headache,Dizziness,Nausea,Constipation,Diarrhea",,,,,
443,Librax 5 mg/2.5 mg Tablet,allopathy,"Irritable Bowel Syndrome (IBS), Peptic ulcers, Anxiety associated with gastrointestinal disorders, Reducing spasms/cramps","Chlordiazepoxide (5mg), Clidinium (2.5mg), Benzodiazepine, Anticholinergic","Sleepiness,Nausea,Constipation,Memory impairment,Dizziness,Blurred vision,Dryness in mouth,Difficulty in urination,Impaired coordination,Depression",,,,,
444,Metformin (Biguanide),allopathy Tablet ,First-line treatment for Type 2 Diabetes to control blood sugar. Also used for PCOS.,Metformin Hydrochloride,"Diarrhea, Nausea, Vomiting, Abdominal discomfort, Metallic taste in mouth. (Rarely, Lactic Acidosis - serious)",,,,,
445,Lisinopril (ACE Inhibitor),allopathy Tablet,"High Blood Pressure (Hypertension), Heart Failure, and protecting kidneys in patients with diabetes.",Lisinopril,"Dry Cough (common), Dizziness, Headache, Fatigue. (Rarely, Angioedema - swelling of the face/throat - serious)",,,,,
446,Amlodipine (Calcium Channel Blocker),allopathy Tablet (or Liquid),High Blood Pressure (Hypertension) and Angina (chest pain).,Amlodipine Besylate (or maleate/mesilate),"Swelling of the ankles/feet, Headache, Flushing, Dizziness, Excessive tiredness.",,,,,
447,Losartan (ARB - Angiotensin II Receptor Blocker),alloapthy Tablet,"High Blood Pressure (Hypertension), reducing stroke risk, and kidney protection in Type 2 Diabetes.",Losartan Potassium,"Dizziness, Back pain, Nasal congestion (stuffy nose), Hyperkalemia (high potassium).",,,,,
448,Glimepiride (Sulfonylurea),allopathy Tablet,Type 2 Diabetes to lower blood sugar.,Glimepiride,"Hypoglycemia (Low Blood Sugar) is the most common and serious risk, Dizziness, Nausea, Headache, Weight gain.",,,,,
449,Empagliflozin (SGLT2 Inhibitor),allopathy Tablet,"Type 2 Diabetes, also used to reduce the risk of cardiovascular death, heart failure, and chronic kidney disease progression.",Empagliflozin,"Urinary Tract Infections (UTIs), Genital yeast infections, Increased urination, Dehydration. (Rarely, Diabetic Ketoacidosis - serious)",,,,,
450,Metformin,Biguanide (PCOS/Diabetes),"Improving insulin resistance, Regulating menstrual cycles, Inducing ovulation, Reducing androgen levels, Managing obesity",Metformin Hydrochloride,"GI upset (Nausea, Diarrhea, Vomiting), Lactic acidosis (Rare), Increased homocysteine levels",,,,,
451,Combined Oral Contraceptive Pill (COCP),Hormone Therapy (PCOS),"Regulating menstrual cycles, Reducing androgen levels, Treating acne, Reducing excessive hair growth (Hirsutism)","Estrogen + Progestin (e.g., Ethinyl Estradiol + various Progestins)","Nausea, Headache, Spotting, Thromboembolism (Blood clots), Breast tenderness, Mood changes",,,,,
452,Clomiphene (Clomid),Ovulation Inducer (PCOS),Inducing ovulation in women with PCOS who are trying to get pregnant,Clomiphene Citrate,"Ovarian enlargement, Ovarian Hyperstimulation Syndrome (OHSS), Multiple pregnancies, Hot flashes, GI distention",,,,,
453,Letrozole (Femara),Aromatase Inhibitor (PCOS),Inducing ovulation (off-label use) for women with fertility problems,Letrozole,"Hot flashes, Joint pain (Arthralgias), Fatigue, Increased risk of osteoporosis",,,,,
454,Spironolactone (Aldactone),Antiandrogen (PCOS),Treating hirsutism (excess hair growth) and acne by blocking the effects of androgens,Spironolactone,"Hyperkalemia (High potassium), Nausea, Dizziness, Breast tenderness, Irregular menstrual cycles",,,,,
455,Cyproterone Acetate,Antiandrogen (PCOS),Treating severe hirsutism and acne (often combined with estrogen),Cyproterone Acetate,"Increased risk of Venous Thromboembolism (VTE), Liver toxicity, Weight gain, Decreased libido",,,,,
456,Finasteride (Propecia),5-alpha-reductase Inhibitor (PCOS),Treating hirsutism (excessive hair growth),Finasteride,"Decreased libido, Erectile dysfunction, Breast tenderness/enlargement, Teratogenic (Causes birth defects, must avoid pregnancy)",,,,,
457,Eflornithine (Vaniqa),Topical Enzyme Inhibitor (PCOS),Slowing the growth of unwanted facial hair (hirsutism),Eflornithine Hydrochloride,"Mild skin irritation, Redness, Burning, Tingling at application site",,,,,
458,Gonadotropins,Hormone (PCOS/Fertility),Inducing ovulation (fertility treatment) when oral medicines are unsuccessful,"Various recombinant or urinary-derived hormones (e.g., FSH/LH)","Ovarian Hyperstimulation Syndrome (OHSS), Injection site reactions, Multiple pregnancies, Headache",,,,,
459,Progestin Therapy,Progestin (PCOS),Regulating menstrual cycles and protecting the uterine lining (endometrium),"Medroxyprogesterone Acetate (MPA), Norethisterone, etc.","Irregular bleeding/spotting, Bloating, Headache, Breast tenderness, Mood changes",,,,,
460,Topical Corticosteroids,Corticosteroid (Skin),"Reducing inflammation, itching, and redness in conditions like Eczema, Psoriasis, and Dermatitis","Hydrocortisone, Betamethasone, Clobetasol (Topical Cream/Ointment/Gel)","Skin thinning (Atrophy), Stretch marks, Acne, Burning/stinging at application site (with prolonged use/high potency)",,,,,
461,Topical Retinoids,Retinoid / Vitamin A Derivative (Skin),"Treating Acne (blackheads, whiteheads, pimples), Psoriasis, Promoting skin cell turnover","Tretinoin, Adapalene, Tazarotene (Topical Gel/Cream)","Dryness, Peeling, Redness, Burning/stinging, Increased photosensitivity (Sunburn risk)",,,,,
462,Benzoyl Peroxide,Keratolytic / Antimicrobial (Skin),"Treating Acne, Killing acne-causing bacteria, Unclogging pores (blackheads/whiteheads)",Benzoyl Peroxide (Topical Gel/Wash),"Dryness, Peeling, Redness, Irritation, Bleaching of hair or clothing",,,,,
463,Oral Antibiotics,Antibiotic (Systemic),"Treating severe Acne, Bacterial skin infections (e.g., Cellulitis, Infected Eczema)","Doxycycline, Erythromycin, Clindamycin (Oral Tablet/Capsule)","GI upset (Nausea, Diarrhea), Photosensitivity, Antibiotic resistance (with overuse), Yeast infections",,,,,
464,Topical Antifungals,Antifungal (Skin),"Treating Fungal infections of the skin (e.g., Ringworm, Athlete's foot, Tinea versicolor)","Clotrimazole, Ketoconazole, Terbinafine (Topical Cream/Gel)","Mild irritation, Itching, Burning sensation, Redness at application site",,,,,
465,Systemic Immunosuppressants,Immunosuppressant (Systemic),"Treating severe Psoriasis, severe Eczema, and other severe Autoimmune skin conditions","Methotrexate, Azathioprine, Cyclosporine (Oral Tablet/Injection)","Liver toxicity, Bone marrow suppression (low blood counts), Nausea, Increased risk of infection",,,,,
